Position, Company, Location, URL
Boeing Korea Summer Intern_Software Engineer의 전체 세부 정보, BOEING, 서울, https://kr.indeed.com/rc/clk?jk=784d33be59a5a14a&fccid=edae4285faf6c2f0&vjs=3
SW Engineer Intern의 전체 세부 정보, INTEL, 서울, https://kr.indeed.com/rc/clk?jk=87862422e27c1249&fccid=936367796261bd6e&vjs=3
AI 비전 엔지니어 부문 인재의 전체 세부 정보, 신세계아이앤씨, 서울 중구, https://kr.indeed.com/rc/clk?jk=2a9808b8b73bb3b2&fccid=7009e9adee12ff99&vjs=3
[양재역] 데이터분석(석박사급 R Python Matlab)의 전체 세부 정보, 시니어앤파트너즈, 서울 서초구, https://kr.indeed.com/rc/clk?jk=9fc0214bdc6f22d1&fccid=59060ddcdf96b101&vjs=3
[인텔리전스랩스] MLOps팀 백엔드 개발자 (Python/Go)의 전체 세부 정보, Nexon, 경기도 성남, https://kr.indeed.com/rc/clk?jk=3dfd7829503d20e6&fccid=aba87288e4cc3687&vjs=3
딥러닝 AI 개발 연구원의 전체 세부 정보, 베이리스, 성남 수정구, https://kr.indeed.com/rc/clk?jk=87309d3ff40ead61&fccid=ce871e9e4a9f430a&vjs=3
Python 분석 인원 정규직 채용의 전체 세부 정보, (주)스마트모빌러티 관심기업, 서울 휘경동, https://kr.indeed.com/rc/clk?jk=5e761f105a377ae8&fccid=307824036b9dcb17&vjs=3
[SAPEON Korea] Frontend Compiler Engineer의 전체 세부 정보, 사피온코리아, 성남 분당구, https://kr.indeed.com/rc/clk?jk=492c2c68fe94ab82&fccid=3e45ffdcf8435b2d&vjs=3
Javascript  Python 교과목 담당 훈련교사(시간)의 전체 세부 정보, 한국디지털직업전문학교, 대구 동구, https://kr.indeed.com/rc/clk?jk=f42102bc3133b7f6&fccid=778d6c36156a735f&vjs=3
데이터분석 신입/경력 정규직의 전체 세부 정보, 블록스퀘어서울, 서울 서초구, https://kr.indeed.com/rc/clk?jk=88960e11c2cdd682&fccid=72348558bd9456ba&vjs=3
인공지능(AI)  머신러닝 신입/경력의 전체 세부 정보, 에스씨에스엠, 세종특별자치시 세종, https://kr.indeed.com/rc/clk?jk=dbf00a893326d4d0&fccid=c1d2112ca5c9e033&vjs=3
파이썬(python) 백엔드 개발자 (전문연구요원 가능)의 전체 세부 정보, 아토머스, 서울 강남구, https://kr.indeed.com/rc/clk?jk=240326a26bd13bf2&fccid=660bbb21789ab63d&vjs=3
PYTHON / SQLD 개발자 (신입·경력)의 전체 세부 정보, 칸테크, 서울 금천구, https://kr.indeed.com/rc/clk?jk=7d40807ebfe3194a&fccid=40a33a8b063b3055&vjs=3
[송파구] 데이터분석(Python R 모델 ML)의 전체 세부 정보, 시니어앤파트너즈, 서울 송파구, https://kr.indeed.com/rc/clk?jk=6b621f682e1d8dad&fccid=59060ddcdf96b101&vjs=3
[데브시스터즈] DevOps Engineer (신입)의 전체 세부 정보, 데브시스터즈, 서울 강남구, https://kr.indeed.com/rc/clk?jk=3058f7280a2e6644&fccid=58a9a803698a0afd&vjs=3
개발자 - Python 서버 프로그램 개발의 전체 세부 정보, 바인테크, 서울 송파구, https://kr.indeed.com/rc/clk?jk=4cc15c26097421c5&fccid=aef44811e748bebe&vjs=3
[데브시스터즈] Data Analyst의 전체 세부 정보, 데브시스터즈, 서울 강남구, https://kr.indeed.com/rc/clk?jk=6b53335986238646&fccid=58a9a803698a0afd&vjs=3
Data/Machine Learning Engineer (신입)의 전체 세부 정보, 플리토, 서울 강남구, https://kr.indeed.com/rc/clk?jk=5ab0b45dfa93411b&fccid=01aed038bcce2a5f&vjs=3
Product Analyst (제품분석경험팀)의 전체 세부 정보, 무신사, 서울 성동구, https://kr.indeed.com/rc/clk?jk=bf2320f2ad1232a9&fccid=a21230b40394711d&vjs=3
[인텔리전스랩스] 데이터 분석가 (유저 모델링)의 전체 세부 정보, Nexon, 경기도 성남, https://kr.indeed.com/rc/clk?jk=a90afa858017fb31&fccid=aba87288e4cc3687&vjs=3
Python 서버 어플리케이션 개발자의 전체 세부 정보, 바인테크, 서울 송파구, https://kr.indeed.com/rc/clk?jk=8a7c4886df34e482&fccid=aef44811e748bebe&vjs=3
웹개발  프론트엔드 신입/경력 계약직의 전체 세부 정보, 뮤레파코리아, 성남 수정구, https://kr.indeed.com/rc/clk?jk=f498a784c28d03bb&fccid=5fc71e9cbda0dfc6&vjs=3
웹개발  백엔드 외 신입/경력 정규직의 전체 세부 정보, 코인챗, 서울 강남구, https://kr.indeed.com/rc/clk?jk=e3f3b7e2103d9bc7&fccid=e60f835b4d91f8e6&vjs=3
IT사업 부문별 경력사원 (사업 확장에 따른 인재 )의 전체 세부 정보, 교보정보통신, 서울 종로구, https://kr.indeed.com/rc/clk?jk=91b5ee6bdae33956&fccid=62d06d841710893c&vjs=3
[메이저 금융그룹 연구소] Data Scientist 경력직 연구원 포지션의 전체 세부 정보, 메이저 금융그룹 연구소, 서울, https://kr.indeed.com/company/%EB%8D%94-%ED%9C%B4%EB%A8%BC/jobs/%EC%97%B0%EA%B5%AC%EC%86%8C-%EC%97%B0%EA%B5%AC%EC%9B%90-f8a5bc05f47465f8?fccid=3cfe13845f73c09f&vjs=3
데이터마이닝  인공지능(AI) 외 경력의 전체 세부 정보, 루벤티스, 서울 강남구, https://kr.indeed.com/rc/clk?jk=da437cb9cae31254&fccid=0513ee429c38f237&vjs=3
[크라우드웍스] 머신러닝(ML) 엔지니어의 전체 세부 정보, 크라우드웍스, 서울 강남구, https://kr.indeed.com/rc/clk?jk=8e165ab93b40c6e9&fccid=a4d8989a0ef28313&vjs=3
[인텔리전스랩스] 플랫폼쉴드팀 백엔드 개발자 (Python/Go)의 전체 세부 정보, Nexon, 경기도 성남, https://kr.indeed.com/rc/clk?jk=2aed57f3623fe66b&fccid=aba87288e4cc3687&vjs=3
Python Backend Engineer의 전체 세부 정보, 마인드에이아이, 서울 중구, https://kr.indeed.com/rc/clk?jk=b2fc2142a72a2007&fccid=6e36b32060404d12&vjs=3
Software Researcher의 전체 세부 정보, 디사일로, 서울 서초구, https://kr.indeed.com/rc/clk?jk=fe4a0d9bf70fb151&fccid=5426751914bc03f8&vjs=3
데이터플랫폼 엔지니어의 전체 세부 정보, 케이뱅크, 서울 중구, https://kr.indeed.com/rc/clk?jk=d2704e137639601a&fccid=5f01cd3935e7f733&vjs=3
AI 연구개발자 전문연구요원(병역특례)의 전체 세부 정보, 라이트비전, 서울 성동구, https://kr.indeed.com/rc/clk?jk=09fe627f6235b375&fccid=e391d8e930358bac&vjs=3
2023년 (주)하람아이 AI팀의 전체 세부 정보, 하람아이, 성남 수정구, https://kr.indeed.com/rc/clk?jk=f1a40936df480707&fccid=5d0ea4093a1ed598&vjs=3
재단법인 한국통계정보원 [통계 분야] 직원(경력  신입)의 전체 세부 정보, 재단법인 한국통계정보원, 대전 서구, https://kr.indeed.com/rc/clk?jk=a736a3493f71d6ba&fccid=2337ac4836ed776c&vjs=3
백엔드 개발자(인턴십)의 전체 세부 정보, 액스, 서울 서초구, https://kr.indeed.com/rc/clk?jk=b7223c792bfcbcd4&fccid=5013eca338141e7d&vjs=3
Back-end 개발자 (신입/경력)의 전체 세부 정보, 디파이, 서울 송파구, https://kr.indeed.com/rc/clk?jk=68c0c5e88cd57f0a&fccid=587b31a49c034c8f&vjs=3
응용프로그램  Web 개발 엔지니어의 전체 세부 정보, 에이피에스티, 서울 강서구, https://kr.indeed.com/rc/clk?jk=2226f969e09c5c80&fccid=9952b8a561919689&vjs=3
[레드테이블] 데이터 엔지니어 / 데이터 마케터 (정규직)의 전체 세부 정보, 레드테이블, 서울 중구, https://kr.indeed.com/rc/clk?jk=778999d4fe8080ec&fccid=ace798f3c93e0fc7&vjs=3
Customer Engineer  Data Analytics  Google Cloud의 전체 세부 정보, 구글코리아, 서울 강남구, https://kr.indeed.com/rc/clk?jk=9e754c9e5723e6a9&fccid=28712efe9a7c8d8a&vjs=3
웹개발자 백엔드&서버개발(HTML·DHTML·mHTML  JAVA 외) 신입/경력 정규직의 전체 세부 정보, 블록스퀘어서울, 서울 서초구, https://kr.indeed.com/rc/clk?jk=1eeb4f006adf13ba&fccid=72348558bd9456ba&vjs=3
2023년 DIgital Lab 전문계약직 상시의 전체 세부 정보, GS칼텍스, 서울 강남구, https://kr.indeed.com/rc/clk?jk=2e45e43017a6ea1f&fccid=f152288f3dcf6e51&vjs=3
Software Engineer - Python and K8s의 전체 세부 정보, Canonical - Jobs, 서울, https://kr.indeed.com/rc/clk?jk=9e154b5b00d09b31&fccid=3911cf63fc0692f4&vjs=3
인공지능(AI)  딥러닝 외 신입/경력의 전체 세부 정보, 스마디안, 서울 관악구, https://kr.indeed.com/rc/clk?jk=651138f697fd4baf&fccid=c0029e119d17504c&vjs=3
셀프 인테리어 위한 AI 플랫폼 서비스 개발자의 전체 세부 정보, 서르, 성남 분당구, https://kr.indeed.com/rc/clk?jk=0a57a69a13126ff5&fccid=07eadb4558c294cb&vjs=3
PHP PYTHON 등 웹 프로그래 개발자의 전체 세부 정보, 서륭통상, 서울 용산구, https://kr.indeed.com/rc/clk?jk=5c4166454bb3bad6&fccid=0be3c6db7dd9c2e5&vjs=3
웹 개발자 경력 Java/Php/Javascript/Python/Html/CSS 등 프로젝트 경력자의 전체 세부 정보, 바이오브레인, 대전 서구, https://kr.indeed.com/rc/clk?jk=941687b6bbb14d81&fccid=a3e2170fc2a54ba6&vjs=3
Advanced Support Engineer / Database & Cloud의 전체 세부 정보, Oracle, 서울, https://kr.indeed.com/rc/clk?jk=001682a211420998&fccid=cd22d01053af7669&vjs=3
Quantitative Researcher의 전체 세부 정보, WorldQuant, 서울, https://kr.indeed.com/rc/clk?jk=e7e8586d716fcf24&fccid=08487f979320ebae&vjs=3
클라우드 플랫폼 운영 엔지니어의 전체 세부 정보, NHN Enterprise, 성남 판교역, https://kr.indeed.com/rc/clk?jk=40e20a58af1e44ee&fccid=cc378bd7bc831eca&vjs=3
[선행기술원] Quantum Computing/Information[책임연구원]의 전체 세부 정보, 현대자동차그룹, 성남 판교역, https://kr.indeed.com/rc/clk?jk=e424415872777a5f&fccid=980d6ecc399a3373&vjs=3
Data Scientist  Growth Analytics Intern - Korea의 전체 세부 정보, MOLOCO, 서울, https://kr.indeed.com/rc/clk?jk=3d0e22b9756facb8&fccid=6588d205440cdcb9&vjs=3
[외국계 IT] SAP 장기 인턴십 대규모 (개발 직군  영업  기술영업  컨설팅 외 다양한 직군)의 전체 세부 정보, 에스에이피코리아, 서울 강남구, https://kr.indeed.com/rc/clk?jk=a60bb9e781b499a4&fccid=d0e6514bf9b6e416&vjs=3
파이썬 개발자 초중급 이상의 전체 세부 정보, 데이터앤솔루션, 서울 서초구, https://kr.indeed.com/rc/clk?jk=d158e683dc0b7500&fccid=02f32b94107c54e3&vjs=3
[올라핀테크] 핀테크 플랫폼 Python(파이썬) 개발자의 전체 세부 정보, 주식회사 올라핀테크 관심기업, 서울 논현동, https://kr.indeed.com/rc/clk?jk=83afc0063130f3f2&fccid=ee9199e84b45d22f&vjs=3
[NHN Enterprise] 클라우드 플랫폼 운영 엔지니어의 전체 세부 정보, 엔에이치엔엔터프라이즈, 성남 분당구, https://kr.indeed.com/rc/clk?jk=90a7214a62825dba&fccid=c6959d0e760ece96&vjs=3
인공지능 솔루션 (AI Solution) 개발의 전체 세부 정보, 카이어, 서울 서초구, https://kr.indeed.com/rc/clk?jk=891485cc2a8e6779&fccid=908ef26c4dd7595f&vjs=3
데이터표준품질부문 경력직 (정규직)의 전체 세부 정보, 한국정보기술단, 서울 강남구, https://kr.indeed.com/rc/clk?jk=2dab915188811f21&fccid=99925e8e7b9604cc&vjs=3
2023 Software Engineering Intern  People with Disabilities (장애인 채용)의 전체 세부 정보, Google, 서울, https://kr.indeed.com/rc/clk?jk=ed7b7e6eb72ffab8&fccid=a5b4499d9e91a5c6&vjs=3
기술 인턴 인공지능 응용 연구/개발 인턴의 전체 세부 정보, 써로마인드로보틱스, 서울 관악구, https://kr.indeed.com/rc/clk?jk=71c47ac87bb4087e&fccid=230e414668234579&vjs=3
[TaaS] Data Scientist[연구원  책임연구원]의 전체 세부 정보, 현대자동차그룹, 서울 강남구, https://kr.indeed.com/rc/clk?jk=67b03ffab1c536ba&fccid=980d6ecc399a3373&vjs=3
[취업축하금300] 미스고 웹 크롤러 - 주거안정비 지원의 전체 세부 정보, 미스고, 서울 강남구, https://kr.indeed.com/rc/clk?jk=dcea8f10155e3061&fccid=28ad02baea3e6b67&vjs=3
이공지능(AI) / 딥러닝 / Computer Vision 경력자 정규직의 전체 세부 정보, 더블미, 서울 서초구, https://kr.indeed.com/rc/clk?jk=bc5131eb1f2981cb&fccid=d7e01b6267e5ba2d&vjs=3
Vocational Training Program Intern(Transaction&Data Virtualization)2024/2025 Graduates Korea VT STAR의 전체 세부 정보, SAP, 서울, https://kr.indeed.com/rc/clk?jk=a5079a89cdbe3ce8&fccid=156c7820d1988640&vjs=3
[경력] 한국일보 백엔드 개발자 공개의 전체 세부 정보, 한국일보사, 서울 중구, https://kr.indeed.com/rc/clk?jk=f7ebb2d08bf51afd&fccid=ae878575af264873&vjs=3
AI 개발 실무교육 및 취업과정 교육생 추가 (수료 후 인턴십  정규직전환)의 전체 세부 정보, 한국인공지능협회, 서울, https://kr.indeed.com/rc/clk?jk=32e28f453e600371&fccid=b5fc950b5542ca9f&vjs=3
자율 주행  로봇 SW 개발자의 전체 세부 정보, 에바, 성남 수정구, https://kr.indeed.com/rc/clk?jk=e30fe92d72ceb17c&fccid=5cc87f5890bd7170&vjs=3
클라우드 보안 엔지니어의 전체 세부 정보, 한국카카오은행, 성남 분당구, https://kr.indeed.com/rc/clk?jk=d5da6f64b9068f77&fccid=aea6a13a3459fdb2&vjs=3
전문연구요원 (병역특례) 수시 (AI / SW 분야)의 전체 세부 정보, 딥엑스, 성남 분당구, https://kr.indeed.com/rc/clk?jk=d83fc0dd2641f483&fccid=e34932b8232a173b&vjs=3
[Engineering Div.] Data Analyst (경력 무관)의 전체 세부 정보, 크래프톤, 서울 강남구, https://kr.indeed.com/rc/clk?jk=eb879964b0336467&fccid=0aeb279b74dee723&vjs=3
Machine Learning Engineer Intern - Korea의 전체 세부 정보, MOLOCO, 서울, https://kr.indeed.com/rc/clk?jk=69d3cc2cca262747&fccid=6588d205440cdcb9&vjs=3
[2023 전문연구요원] AI R&D-Language AI의 전체 세부 정보, 엔씨소프트, 성남 판교역, https://kr.indeed.com/rc/clk?jk=7da87f6985949b06&fccid=a1e4e21b1f33cf40&vjs=3
[크라우드웍스] NLP 엔지니어의 전체 세부 정보, 크라우드웍스, 서울 강남구, https://kr.indeed.com/rc/clk?jk=329e2b0216072240&fccid=a4d8989a0ef28313&vjs=3
AI 연구 MLOps의 전체 세부 정보, 코그넷나인, 서울 서초구, https://kr.indeed.com/rc/clk?jk=36ae5f764253d121&fccid=015d2bad6d9df969&vjs=3
Junior Data Scientist의 전체 세부 정보, Logistics Management Institute, 서울, https://kr.indeed.com/rc/clk?jk=ffcab40699b79c6b&fccid=12626f295bf6a003&vjs=3
Data Scientist in Financial의 전체 세부 정보, 페니로이스, 서울 종로구, https://kr.indeed.com/rc/clk?jk=8384fbc0b8152ec6&fccid=071ef5e261747b4b&vjs=3
Full-stack Python Developer , Lemon.io, Latin America Only/Europe Only/UK Only/Canada Only, /remote-jobs/lemon-io-full-stack-python-developer
Freelance Python Developer and AWS Manager at Easy Energy Inc, Contra, Anywhere in the World, /remote-jobs/contra-freelance-python-developer-and-aws-manager-at-easy-energy-inc
Python Developer, RemoteMore, Americas Only/Europe Only/Africa Only, /remote-jobs/remotemore-python-developer-6
Senior Python Engineer, Shake, Anywhere in the World, /remote-jobs/shake-senior-python-engineer-1
Senior Open Source Developer & DevOps (Python  Django  React  AWS/OpenStack), OpenCraft, Anywhere in the World, /remote-jobs/opencraft-senior-open-source-developer-devops-python-django-react-aws-openstack
Senior Python Engineer: Long-term job - 100% remote, Proxify AB, Anywhere in the World, /remote-jobs/proxify-ab-senior-python-engineer-long-term-job-100-remote
Senior/Staff Software Engineer - Backend/Python - USA (100% Remote), Close, USA Only, /remote-jobs/close-senior-staff-software-engineer-backend-python-usa-100-remote
Software Engineer - Backend/Python (100% Remote), Close, Latin America Only/Europe Only/Africa Only, /remote-jobs/close-software-engineer-backend-python-100-remote-2
Software Engineer in Test – Python – Cyprus  Greece or Remote , XM, Anywhere in the World, /remote-jobs/xm-software-engineer-in-test-python-cyprus-greece-or-remote-3
